{
  "$schema": "https://json-schema.org/draft/2020-12/schema",
  "$id": "https://themeanax.com/schema/nic-content-request-1.schema.json",
  "title": "NIC demo content request (nic-content-request/1)",
  "description": "Written by nic-wp-theme, read by `themeseed nic-demo --request`. Spec: docs/superpowers/specs/2026-10-13-demo-content-contract.md",
  "type": "object",
  "additionalProperties": false,
  "required": ["format", "theme", "target", "site", "types"],
  "properties": {
    "format": {
      "const": "nic-content-request/1"
    },
    "theme": {
      "type": "string",
      "pattern": "^[a-z0-9][a-z0-9-]{0,99}$"
    },
    "target": {
      "enum": ["themeforest", "wordpress.org", "client", "private"]
    },
    "site": {
      "type": "object",
      "additionalProperties": false,
      "required": ["name", "topic"],
      "properties": {
        "name": {
          "type": "string",
          "minLength": 1
        },
        "topic": {
          "type": "string",
          "minLength": 1
        },
        "language": {
          "type": "string",
          "default": "en"
        },
        "tone": {
          "type": "string"
        }
      }
    },
    "images": {
      "type": "object",
      "additionalProperties": false,
      "properties": {
        "source": {
          "enum": ["auto", "local", "ai", "stock", "none"],
          "default": "auto"
        }
      }
    },
    "types": {
      "type": "object",
      "additionalProperties": false,
      "minProperties": 1,
      "properties": {
        "post": {
          "$ref": "#/$defs/typeRequest"
        },
        "team": {
          "$ref": "#/$defs/typeRequest"
        },
        "portfolio": {
          "$ref": "#/$defs/typeRequest"
        },
        "testimonial": {
          "$ref": "#/$defs/typeRequest"
        },
        "service": {
          "$ref": "#/$defs/typeRequest"
        },
        "product": {
          "$ref": "#/$defs/typeRequest"
        }
      }
    }
  },
  "$defs": {
    "typeRequest": {
      "type": "object",
      "additionalProperties": false,
      "required": ["count"],
      "properties": {
        "count": {
          "type": "integer",
          "minimum": 0,
          "maximum": 50
        },
        "seeds": {
          "type": "array",
          "description": "The source design's own items. key, title and every non-empty field are kept verbatim.",
          "items": {
            "type": "object",
            "additionalProperties": false,
            "required": ["key", "title"],
            "properties": {
              "key": {
                "type": "string",
                "pattern": "^[a-z0-9][a-z0-9-]{0,99}$"
              },
              "title": {
                "type": "string",
                "minLength": 1
              },
              "content": {
                "type": "string"
              },
              "excerpt": {
                "type": "string"
              },
              "meta": {
                "type": "object",
                "additionalProperties": {
                  "type": "string"
                }
              },
              "image_size": {
                "type": "array",
                "items": {
                  "type": "integer",
                  "minimum": 1
                },
                "minItems": 2,
                "maxItems": 2
              },
              "product": {
                "description": "Product seeds only: the nic-content-1 product block (see that schema's $defs.product.properties.product).",
                "type": "object"
              },
              "terms": {
                "type": "object",
                "additionalProperties": {
                  "type": "array",
                  "items": {
                    "type": "string",
                    "pattern": "^[a-z0-9][a-z0-9-]{0,99}$"
                  }
                }
              }
            }
          }
        }
      }
    }
  }
}
